[
  {
    "id": "expressionValue-001",
    "biosampleId": "008dafdd-a3d1-4801-8c0a-8714e2b58e48",
    "featureId": "ENSG00000141510.18",
    "matrixId": "matrix-gene-expression-001",
    "value": 100
  },
  {
    "id": "expressionValue-tp53-gse88557-001",
    "biosampleId": "008dafdd-a3d1-4801-8c0a-8714e2b58e48",
    "featureId": "ENSG00000141510.18",
    "matrixId": "GSE88557",
    "value": 1247.5
  },
  {
    "id": "expressionValue-002",
    "biosampleId": "sample-example-0001",
    "featureId": "ENSG00000141510.18",
    "matrixId": "matrix-gene-expression-001",
    "value": 42.5
  }
]
